{"$id":"https://outerheavenx.github.io/citadel-of-vesper/schemas/ability.schema.json","$schema":"https://json-schema.org/draft/2020-12/schema","additionalProperties":false,"description":"Traversal ability or spell. All names and effects are original.","properties":{"description":{"type":"string"},"effect":{"description":"Machine-readable effect descriptor consumed by later waves.","type":"object"},"element":{"enum":["fire","ice","lightning","shadow","holy","arcane"]},"icon":{"type":"string"},"id":{"pattern":"^[a-z0-9_]+$","type":"string"},"kind":{"enum":["traversal","spell"]},"mpCost":{"minimum":0,"type":"integer"},"name":{"type":"string"}},"required":["id","name","kind","description","icon"],"title":"Ability","type":"object"}