[{"description":"Hurl a wave of cinder that rolls along the ground and bursts against foes.","effect":{"damage":1.6,"type":"fire"},"element":"fire","icon":"cinder_wave","id":"cinder_wave","kind":"spell","mpCost":8,"name":"Cinder Wave"},{"description":"Surge forward through the air, trailing pale light. Crosses gaps no jump can reach.","effect":{"dashSpeed":300,"dashTime":0.16},"icon":"gale_dash","id":"gale_dash","kind":"traversal","name":"Gale Dash"},{"description":"Knit wounds with pale light drawn from the moon. Restores a portion of max HP.","effect":{"healPercent":0.4,"type":"holy"},"element":"holy","icon":"mending_pulse","id":"mending_pulse","kind":"spell","mpCost":10,"name":"Mending Pulse"},{"description":"Moonrise Leap: Lucien learns to catch the moonlight and spring a second time mid-air, a pale crescent flashing beneath his boots.","effect":{"doubleJumpVelocityMult":0.95,"extraJumps":1,"fx":"pale_crescent","sfx":"dash","unlockSource":"boss:chapel_warden"},"icon":"moonrise_leap","id":"moonrise_leap","kind":"traversal","name":"Moonrise Leap"}]